address,category,city,km distance,latitude,longitude,name,num reviews,origination,permanently closed?,price,rating,state
"3327 Main St, Keokuk, IA 52632",dental,Keokuk,28.489711390191705,40.4181442260742,-91.4049301147461,Buffalo Prairie Dental Care,1,"Donnellson, IA",False,-1,5.0,IA
"401 S Gear Ave, West Burlington, IA 52655",dental,West Burlington,38.55632119700841,40.8221844674038,-91.1704704165459,Aspen Dental,3,"Donnellson, IA",False,-1,1.0,IA
"106 E Washington Ave, Fairfield, IA 52556",dental,Fairfield,52.2932579108689,41.0053787,-91.9615402,Holt Family Dental Care,1,"Donnellson, IA",False,-1,5.0,IA
"1727 Deer Run Dr, Burlington, IA 52601",dental,Burlington,41.35498556989751,40.8268881,-91.1356592,"Mary Schilling McManis, DDS",2,"Donnellson, IA",False,-1,3.5,IA
"1605 Ave E, Fort Madison, IA 52627",dental,Fort Madison,19.994798668477365,40.6334851,-91.3267874,"Paul S Kunch, DDS",3,"Donnellson, IA",False,-1,1.0,IA
"1804 E Washington St, Dental Specialists Of Lowa Building, Mount Pleasant, IA 52641",dental,Mount Pleasant,35.299478562444854,40.9606325211969,-91.5269516093459,Orthodontic Associates of Iowa,1,"Donnellson, IA",False,-1,1.0,IA
"1225 S Gear Ave, Ste 156, West Burlington, IA 52655",dental,West Burlington,37.876857023572015,40.809413,-91.172286,"Raymond F Roewe, DDS",3,"Donnellson, IA",False,-1,3.5,IA
